{
  "authority": "D-sorganization/Tools",
  "entries": [
    {
      "authority_status": "not-applicable",
      "bytes_lf": 2936,
      "classification": "non-calculation",
      "classification_basis": "no-conservative-calculation-signal",
      "content_sha256_lf": "569fbb0a01cdeacc8489c36d63b0ae20d8aaedc97a7f3642a5c825beefbe9db8",
      "family": "shared-tools-non-calculation",
      "id": "TOOLS-MODULE-SRC-SHARED-PYTHON-SIDEKICK-THEME-INIT-PY-89662AC69551",
      "language": "python",
      "maintainer": "Tools module maintainers",
      "path": "src/shared/python/sidekick/theme/__init__.py",
      "purpose": "Theme management system for the UpstreamDrift fleet.",
      "review_status": "inventory-baseline",
      "risk_tags": [
        "downstream-consumer-risk"
      ],
      "states": {
        "adrs": "mapped",
        "artifacts": "not-applicable",
        "chapters": "unmapped-pending-TOOLS-D4",
        "citations": "not-applicable",
        "equation_pathway": "not-applicable",
        "public_surfaces": "unavailable",
        "publication": "blocked",
        "routes": "not-applicable",
        "tests": "not-applicable",
        "units": "mapped",
        "validation": "not-applicable"
      },
      "traceability": {
        "adr_paths": [
          "docs/adr/ADR-002-shared-library-module-structure.md"
        ],
        "artifact_sha256": [],
        "chapter_paths": [],
        "citation_refs": [],
        "equation_refs": [],
        "public_routes": [],
        "public_surfaces": [],
        "test_paths": [],
        "unit_mentions": [
          "g",
          "s"
        ],
        "validation_paths": []
      }
    }
  ],
  "package": "src/shared/python/sidekick/theme",
  "schema_version": "tools-module-inventory-shard/1.1.0"
}
