{
  "authority": "D-sorganization/Tools",
  "entries": [
    {
      "authority_status": "not-applicable",
      "bytes_lf": 243,
      "classification": "non-calculation",
      "classification_basis": "no-conservative-calculation-signal",
      "content_sha256_lf": "7e895a71df97da144559b3359194205f90a664814f32311a4958578d6d7b3619",
      "family": "shared-tools-non-calculation",
      "id": "TOOLS-MODULE-SRC-CHAT-INIT-PY-1F1BCAA24180",
      "language": "python",
      "maintainer": "Tools module maintainers",
      "path": "src/chat/__init__.py",
      "purpose": "Compatibility shim for the canonical ``shared.python.chat`` package.",
      "review_status": "inventory-baseline",
      "risk_tags": [],
      "states": {
        "adrs": "mapped",
        "artifacts": "not-applicable",
        "chapters": "unmapped-pending-TOOLS-D4",
        "citations": "not-applicable",
        "equation_pathway": "not-applicable",
        "public_surfaces": "unavailable",
        "publication": "blocked",
        "routes": "not-applicable",
        "tests": "not-applicable",
        "units": "not-applicable",
        "validation": "not-applicable"
      },
      "traceability": {
        "adr_paths": [
          "docs/adr/ADR-002-shared-library-module-structure.md"
        ],
        "artifact_sha256": [],
        "chapter_paths": [],
        "citation_refs": [],
        "equation_refs": [],
        "public_routes": [],
        "public_surfaces": [],
        "test_paths": [],
        "unit_mentions": [],
        "validation_paths": []
      }
    }
  ],
  "package": "src/chat",
  "schema_version": "tools-module-inventory-shard/1.1.0"
}
