{
  "authority": "D-sorganization/Tools",
  "entries": [
    {
      "authority_status": "not-applicable",
      "bytes_lf": 1801,
      "classification": "non-calculation",
      "classification_basis": "no-conservative-calculation-signal",
      "content_sha256_lf": "881bf74751221ee40968453f53c8ff36333a398de57295e9ff7c4d23323c3276",
      "family": "rate-of-closure-non-calculation",
      "id": "TOOLS-MODULE-SRC-RATE-OF-CLOSURE-WEB-SCRIPTS-REFRESH-VENDORED-MJS-9D5F28BB9056",
      "language": "javascript",
      "maintainer": "Rate of Closure maintainers",
      "path": "src/rate_of_closure/web/scripts/refresh-vendored.mjs",
      "purpose": null,
      "review_status": "inventory-baseline",
      "risk_tags": [],
      "states": {
        "adrs": "mapped",
        "artifacts": "not-applicable",
        "chapters": "unmapped-pending-TOOLS-D4",
        "citations": "not-applicable",
        "equation_pathway": "not-applicable",
        "public_surfaces": "unavailable",
        "publication": "blocked",
        "routes": "not-applicable",
        "tests": "not-applicable",
        "units": "not-applicable",
        "validation": "not-applicable"
      },
      "traceability": {
        "adr_paths": [
          "docs/adr/ADR-002-shared-library-module-structure.md"
        ],
        "artifact_sha256": [],
        "chapter_paths": [],
        "citation_refs": [],
        "equation_refs": [],
        "public_routes": [],
        "public_surfaces": [],
        "test_paths": [],
        "unit_mentions": [],
        "validation_paths": []
      }
    }
  ],
  "package": "src/rate_of_closure/web/scripts",
  "schema_version": "tools-module-inventory-shard/1.1.0"
}
