{
  "authority": "D-sorganization/Tools",
  "entries": [
    {
      "authority_status": "provisional",
      "bytes_lf": 251,
      "classification": "calculation",
      "classification_basis": "path-marker:rotation",
      "content_sha256_lf": "3a5959546231ff5c5300c52d775babf15377b865bd381f810f23384d40bbe817",
      "family": "shared-tools-calculation",
      "id": "TOOLS-MODULE-SRC-ROTATION-TRANSFORMS-INIT-PY-81561691B103",
      "language": "python",
      "maintainer": "Tools module maintainers",
      "path": "src/rotation_transforms/__init__.py",
      "purpose": "Compatibility shim for ``shared.python.rotation_transforms``.",
      "review_status": "review-required",
      "risk_tags": [
        "scientific-review-required",
        "source-provenance-unmapped",
        "test-evidence-unmapped",
        "unit-contract-review"
      ],
      "states": {
        "adrs": "mapped",
        "artifacts": "unmapped-pending-TOOLS-D7",
        "chapters": "unmapped-pending-TOOLS-D4",
        "citations": "unavailable",
        "equation_pathway": "unmapped-pending-TOOLS-D4",
        "public_surfaces": "unavailable",
        "publication": "blocked",
        "routes": "not-applicable",
        "tests": "unavailable",
        "units": "unavailable",
        "validation": "unavailable"
      },
      "traceability": {
        "adr_paths": [
          "docs/adr/ADR-002-shared-library-module-structure.md"
        ],
        "artifact_sha256": [],
        "chapter_paths": [],
        "citation_refs": [],
        "equation_refs": [],
        "public_routes": [],
        "public_surfaces": [],
        "test_paths": [],
        "unit_mentions": [],
        "validation_paths": []
      }
    }
  ],
  "package": "src/rotation_transforms",
  "schema_version": "tools-module-inventory-shard/1.1.0"
}
