{
  "authority": "D-sorganization/Tools",
  "entries": [
    {
      "authority_status": "not-applicable",
      "bytes_lf": 420,
      "classification": "non-calculation",
      "classification_basis": "no-conservative-calculation-signal",
      "content_sha256_lf": "aaf8af152cc8a5172efce2b5c2b1d8833f2bcbb1465b934a3299835e43c88953",
      "family": "repository-governance-non-calculation",
      "id": "TOOLS-MODULE-CONFIG-COVERAGE-BASELINE-JSON-19F283CB661C",
      "language": "json",
      "maintainer": "Repository governance maintainers",
      "path": "config/coverage_baseline.json",
      "purpose": null,
      "review_status": "inventory-baseline",
      "risk_tags": [],
      "states": {
        "adrs": "unavailable",
        "artifacts": "not-applicable",
        "chapters": "unmapped-pending-TOOLS-D4",
        "citations": "not-applicable",
        "equation_pathway": "not-applicable",
        "public_surfaces": "unavailable",
        "publication": "blocked",
        "routes": "not-applicable",
        "tests": "not-applicable",
        "units": "not-applicable",
        "validation": "not-applicable"
      },
      "traceability": {
        "adr_paths": [],
        "artifact_sha256": [],
        "chapter_paths": [],
        "citation_refs": [],
        "equation_refs": [],
        "public_routes": [],
        "public_surfaces": [],
        "test_paths": [],
        "unit_mentions": [],
        "validation_paths": []
      }
    },
    {
      "authority_status": "not-applicable",
      "bytes_lf": 760,
      "classification": "non-calculation",
      "classification_basis": "no-conservative-calculation-signal",
      "content_sha256_lf": "6780b803e2090778dfb9f696f64a6facebc6787be75df2c69d79d5ed74a4ff71",
      "family": "repository-governance-non-calculation",
      "id": "TOOLS-MODULE-CONFIG-COVERAGE-POLICY-JSON-37185D254DC2",
      "language": "json",
      "maintainer": "Repository governance maintainers",
      "path": "config/coverage_policy.json",
      "purpose": null,
      "review_status": "inventory-baseline",
      "risk_tags": [],
      "states": {
        "adrs": "unavailable",
        "artifacts": "not-applicable",
        "chapters": "unmapped-pending-TOOLS-D4",
        "citations": "not-applicable",
        "equation_pathway": "not-applicable",
        "public_surfaces": "unavailable",
        "publication": "blocked",
        "routes": "not-applicable",
        "tests": "not-applicable",
        "units": "not-applicable",
        "validation": "not-applicable"
      },
      "traceability": {
        "adr_paths": [],
        "artifact_sha256": [],
        "chapter_paths": [],
        "citation_refs": [],
        "equation_refs": [],
        "public_routes": [],
        "public_surfaces": [],
        "test_paths": [],
        "unit_mentions": [],
        "validation_paths": []
      }
    },
    {
      "authority_status": "not-applicable",
      "bytes_lf": 7926,
      "classification": "non-calculation",
      "classification_basis": "no-conservative-calculation-signal",
      "content_sha256_lf": "89ed112d343d23cbf645d9d72a30c919f34d626f282e976c7c9ca377f69d458f",
      "family": "repository-governance-non-calculation",
      "id": "TOOLS-MODULE-CONFIG-DESIGN-MANUAL-GOVERNANCE-JSON-36B84BAED1E6",
      "language": "json",
      "maintainer": "Repository governance maintainers",
      "path": "config/design_manual_governance.json",
      "purpose": null,
      "review_status": "inventory-baseline",
      "risk_tags": [],
      "states": {
        "adrs": "unavailable",
        "artifacts": "not-applicable",
        "chapters": "unmapped-pending-TOOLS-D4",
        "citations": "mapped",
        "equation_pathway": "not-applicable",
        "public_surfaces": "unavailable",
        "publication": "blocked",
        "routes": "not-applicable",
        "tests": "not-applicable",
        "units": "not-applicable",
        "validation": "not-applicable"
      },
      "traceability": {
        "adr_paths": [],
        "artifact_sha256": [],
        "chapter_paths": [],
        "citation_refs": [
          "https://schemas.d-sorganization.org/calculation-registry/1.0.0.json",
          "https://schemas.d-sorganization.org/engineering-manuals/publication-projection/1.0.0"
        ],
        "equation_refs": [],
        "public_routes": [],
        "public_surfaces": [],
        "test_paths": [],
        "unit_mentions": [],
        "validation_paths": []
      }
    },
    {
      "authority_status": "not-applicable",
      "bytes_lf": 380,
      "classification": "non-calculation",
      "classification_basis": "no-conservative-calculation-signal",
      "content_sha256_lf": "289f716afad3bd09072a0c16568fab05af0163238e3a19cf0d2897bcb7d40531",
      "family": "repository-governance-non-calculation",
      "id": "TOOLS-MODULE-CONFIG-LICENSE-DENYLIST-JSON-0C09E264AB81",
      "language": "json",
      "maintainer": "Repository governance maintainers",
      "path": "config/license_denylist.json",
      "purpose": null,
      "review_status": "inventory-baseline",
      "risk_tags": [],
      "states": {
        "adrs": "mapped",
        "artifacts": "not-applicable",
        "chapters": "unmapped-pending-TOOLS-D4",
        "citations": "not-applicable",
        "equation_pathway": "not-applicable",
        "public_surfaces": "unavailable",
        "publication": "blocked",
        "routes": "not-applicable",
        "tests": "mapped",
        "units": "not-applicable",
        "validation": "not-applicable"
      },
      "traceability": {
        "adr_paths": [
          "docs/adr/ADR-008-markerless-mocap-authority-and-licensing.md"
        ],
        "artifact_sha256": [],
        "chapter_paths": [],
        "citation_refs": [],
        "equation_refs": [],
        "public_routes": [],
        "public_surfaces": [],
        "test_paths": [
          "tests/architecture/test_license_denylist.py"
        ],
        "unit_mentions": [],
        "validation_paths": []
      }
    },
    {
      "authority_status": "not-applicable",
      "bytes_lf": 949,
      "classification": "non-calculation",
      "classification_basis": "no-conservative-calculation-signal",
      "content_sha256_lf": "8a4560405cd5355e1cb4344e7a900254bc0892fcb31c53379465c7ea0e2f8f8d",
      "family": "repository-governance-non-calculation",
      "id": "TOOLS-MODULE-CONFIG-MODULE-SIZE-BUDGET-BASELINE-JSON-486F02965545",
      "language": "json",
      "maintainer": "Repository governance maintainers",
      "path": "config/module_size_budget_baseline.json",
      "purpose": null,
      "review_status": "inventory-baseline",
      "risk_tags": [],
      "states": {
        "adrs": "unavailable",
        "artifacts": "not-applicable",
        "chapters": "unmapped-pending-TOOLS-D4",
        "citations": "not-applicable",
        "equation_pathway": "not-applicable",
        "public_surfaces": "unavailable",
        "publication": "blocked",
        "routes": "not-applicable",
        "tests": "not-applicable",
        "units": "not-applicable",
        "validation": "not-applicable"
      },
      "traceability": {
        "adr_paths": [],
        "artifact_sha256": [],
        "chapter_paths": [],
        "citation_refs": [],
        "equation_refs": [],
        "public_routes": [],
        "public_surfaces": [],
        "test_paths": [],
        "unit_mentions": [],
        "validation_paths": []
      }
    },
    {
      "authority_status": "not-applicable",
      "bytes_lf": 761,
      "classification": "non-calculation",
      "classification_basis": "no-conservative-calculation-signal",
      "content_sha256_lf": "dcd71021c41c3d45161035b648adc64c813d2a521bf99402b5cfebacd84525db",
      "family": "repository-governance-non-calculation",
      "id": "TOOLS-MODULE-CONFIG-PYQT6-BINARY-STACK-POLICY-V1-JSON-9C91D4CFFA1D",
      "language": "json",
      "maintainer": "Repository governance maintainers",
      "path": "config/pyqt6_binary_stack_policy.v1.json",
      "purpose": null,
      "review_status": "inventory-baseline",
      "risk_tags": [],
      "states": {
        "adrs": "unavailable",
        "artifacts": "not-applicable",
        "chapters": "unmapped-pending-TOOLS-D4",
        "citations": "not-applicable",
        "equation_pathway": "not-applicable",
        "public_surfaces": "unavailable",
        "publication": "blocked",
        "routes": "not-applicable",
        "tests": "not-applicable",
        "units": "not-applicable",
        "validation": "not-applicable"
      },
      "traceability": {
        "adr_paths": [],
        "artifact_sha256": [],
        "chapter_paths": [],
        "citation_refs": [],
        "equation_refs": [],
        "public_routes": [],
        "public_surfaces": [],
        "test_paths": [],
        "unit_mentions": [],
        "validation_paths": []
      }
    }
  ],
  "package": "config",
  "schema_version": "tools-module-inventory-shard/1.1.0"
}
