{
  "authority": "D-sorganization/Tools",
  "entries": [
    {
      "authority_status": "not-applicable",
      "bytes_lf": 63,
      "classification": "non-calculation",
      "classification_basis": "no-conservative-calculation-signal",
      "content_sha256_lf": "4922548c6181abc6bfd12fad55f2f1d34e10aaf44ef662ca9ed4209c5ddef528",
      "family": "rate-of-closure-non-calculation",
      "id": "TOOLS-MODULE-SRC-RATE-OF-CLOSURE-SCRIPTS-INIT-PY-2E1F2E6DC4D2",
      "language": "python",
      "maintainer": "Rate of Closure maintainers",
      "path": "src/rate_of_closure/scripts/__init__.py",
      "purpose": "Utility scripts for the Rate of Closure Impact Explorer.",
      "review_status": "inventory-baseline",
      "risk_tags": [],
      "states": {
        "adrs": "mapped",
        "artifacts": "not-applicable",
        "chapters": "unmapped-pending-TOOLS-D4",
        "citations": "not-applicable",
        "equation_pathway": "not-applicable",
        "public_surfaces": "unavailable",
        "publication": "blocked",
        "routes": "not-applicable",
        "tests": "not-applicable",
        "units": "not-applicable",
        "validation": "not-applicable"
      },
      "traceability": {
        "adr_paths": [
          "docs/adr/ADR-002-shared-library-module-structure.md"
        ],
        "artifact_sha256": [],
        "chapter_paths": [],
        "citation_refs": [],
        "equation_refs": [],
        "public_routes": [],
        "public_surfaces": [],
        "test_paths": [],
        "unit_mentions": [],
        "validation_paths": []
      }
    },
    {
      "authority_status": "provisional",
      "bytes_lf": 2663,
      "classification": "calculation",
      "classification_basis": "scientific-library-import",
      "content_sha256_lf": "ce33b3ccd326772aa033401b40f41dab46525b9e111e4da38574f346fb8abcd3",
      "family": "rate-of-closure-calculation",
      "id": "TOOLS-MODULE-SRC-RATE-OF-CLOSURE-SCRIPTS-GENERATE-EXAMPLE-HEAD-PY-6DE1C6B8923B",
      "language": "python",
      "maintainer": "Rate of Closure maintainers",
      "path": "src/rate_of_closure/scripts/generate_example_head.py",
      "purpose": "Generate the bundled example clubhead STL — no third-party geometry.",
      "review_status": "review-required",
      "risk_tags": [
        "public-api",
        "scientific-review-required",
        "source-provenance-unmapped",
        "unit-contract-review"
      ],
      "states": {
        "adrs": "mapped",
        "artifacts": "unmapped-pending-TOOLS-D7",
        "chapters": "unmapped-pending-TOOLS-D4",
        "citations": "unavailable",
        "equation_pathway": "unmapped-pending-TOOLS-D4",
        "public_surfaces": "mapped",
        "publication": "blocked",
        "routes": "not-applicable",
        "tests": "mapped",
        "units": "mapped",
        "validation": "unavailable"
      },
      "traceability": {
        "adr_paths": [
          "docs/adr/ADR-002-shared-library-module-structure.md",
          "docs/adr/ADR-003-api-stability-policy.md"
        ],
        "artifact_sha256": [],
        "chapter_paths": [],
        "citation_refs": [],
        "equation_refs": [],
        "public_routes": [],
        "public_surfaces": [
          {
            "kind": "constant",
            "name": "ASSET_PATH",
            "signature": null
          },
          {
            "kind": "function",
            "name": "build_example_head",
            "signature": ""
          },
          {
            "kind": "function",
            "name": "main",
            "signature": ""
          }
        ],
        "test_paths": [
          "tests/rate_of_closure/pyqt_club_camera_probe.py",
          "tests/rate_of_closure/test_gui.py",
          "tests/rate_of_closure/test_mesh.py"
        ],
        "unit_mentions": [
          "N",
          "g",
          "s"
        ],
        "validation_paths": []
      }
    }
  ],
  "package": "src/rate_of_closure/scripts",
  "schema_version": "tools-module-inventory-shard/1.1.0"
}
