{
  "authority": "D-sorganization/Tools",
  "entries": [
    {
      "authority_status": "not-applicable",
      "bytes_lf": 245,
      "classification": "non-calculation",
      "classification_basis": "no-conservative-calculation-signal",
      "content_sha256_lf": "befdbc189000bfec72914610e27812bfc23ea52a00e4b6c09faa38ad7944af4d",
      "family": "shared-tools-non-calculation",
      "id": "TOOLS-MODULE-SRC-NOTES-INIT-PY-F733C73DA069",
      "language": "python",
      "maintainer": "Tools module maintainers",
      "path": "src/notes/__init__.py",
      "purpose": "Compatibility shim for the canonical ``shared.python.notes`` package.",
      "review_status": "inventory-baseline",
      "risk_tags": [],
      "states": {
        "adrs": "mapped",
        "artifacts": "not-applicable",
        "chapters": "unmapped-pending-TOOLS-D4",
        "citations": "not-applicable",
        "equation_pathway": "not-applicable",
        "public_surfaces": "unavailable",
        "publication": "blocked",
        "routes": "not-applicable",
        "tests": "not-applicable",
        "units": "not-applicable",
        "validation": "not-applicable"
      },
      "traceability": {
        "adr_paths": [
          "docs/adr/ADR-002-shared-library-module-structure.md"
        ],
        "artifact_sha256": [],
        "chapter_paths": [],
        "citation_refs": [],
        "equation_refs": [],
        "public_routes": [],
        "public_surfaces": [],
        "test_paths": [],
        "unit_mentions": [],
        "validation_paths": []
      }
    }
  ],
  "package": "src/notes",
  "schema_version": "tools-module-inventory-shard/1.1.0"
}
