{
  "authority": "D-sorganization/Tools",
  "entries": [
    {
      "authority_status": "not-applicable",
      "bytes_lf": 267,
      "classification": "non-calculation",
      "classification_basis": "no-conservative-calculation-signal",
      "content_sha256_lf": "8826ffe76c1df27f76aea2e08e8eb275fa6f1c6a6928726957ac820d66af786a",
      "family": "shared-tools-non-calculation",
      "id": "TOOLS-MODULE-SRC-PROGRAMMATIC-PID-INIT-PY-C5276C5FAEAD",
      "language": "python",
      "maintainer": "Tools module maintainers",
      "path": "src/programmatic_pid/__init__.py",
      "purpose": "Compatibility shim for the canonical ``shared.python.programmatic_pid`` package.",
      "review_status": "inventory-baseline",
      "risk_tags": [],
      "states": {
        "adrs": "mapped",
        "artifacts": "not-applicable",
        "chapters": "unmapped-pending-TOOLS-D4",
        "citations": "not-applicable",
        "equation_pathway": "not-applicable",
        "public_surfaces": "unavailable",
        "publication": "blocked",
        "routes": "not-applicable",
        "tests": "not-applicable",
        "units": "not-applicable",
        "validation": "not-applicable"
      },
      "traceability": {
        "adr_paths": [
          "docs/adr/ADR-002-shared-library-module-structure.md"
        ],
        "artifact_sha256": [],
        "chapter_paths": [],
        "citation_refs": [],
        "equation_refs": [],
        "public_routes": [],
        "public_surfaces": [],
        "test_paths": [],
        "unit_mentions": [],
        "validation_paths": []
      }
    }
  ],
  "package": "src/programmatic_pid",
  "schema_version": "tools-module-inventory-shard/1.1.0"
}
