{
  "authority": "D-sorganization/Tools",
  "entries": [
    {
      "authority_status": "not-applicable",
      "bytes_lf": 901,
      "classification": "non-calculation",
      "classification_basis": "no-conservative-calculation-signal",
      "content_sha256_lf": "26d5e04a95b09b3ba279852b0b8be6b270606fd3ac8f80b736957c1ea440d55c",
      "family": "shared-tools-non-calculation",
      "id": "TOOLS-MODULE-SRC-SHARED-PYTHON-DATA-PROCESSOR-IO-INIT-PY-F39B0C83C2C1",
      "language": "python",
      "maintainer": "Tools module maintainers",
      "path": "src/shared/python/data_processor_io/__init__.py",
      "purpose": "Bulk-I/O engine package for the Data Processor (issue #2989).",
      "review_status": "inventory-baseline",
      "risk_tags": [
        "downstream-consumer-risk",
        "public-api"
      ],
      "states": {
        "adrs": "mapped",
        "artifacts": "not-applicable",
        "chapters": "unmapped-pending-TOOLS-D4",
        "citations": "not-applicable",
        "equation_pathway": "not-applicable",
        "public_surfaces": "mapped",
        "publication": "blocked",
        "routes": "not-applicable",
        "tests": "not-applicable",
        "units": "not-applicable",
        "validation": "not-applicable"
      },
      "traceability": {
        "adr_paths": [
          "docs/adr/ADR-002-shared-library-module-structure.md",
          "docs/adr/ADR-003-api-stability-policy.md"
        ],
        "artifact_sha256": [],
        "chapter_paths": [],
        "citation_refs": [],
        "equation_refs": [],
        "public_routes": [],
        "public_surfaces": [
          {
            "kind": "re-export",
            "name": "CancellationToken",
            "signature": null
          },
          {
            "kind": "re-export",
            "name": "ConversionReport",
            "signature": null
          },
          {
            "kind": "re-export",
            "name": "DataProcessorRustError",
            "signature": null
          },
          {
            "kind": "re-export",
            "name": "OperationCancelled",
            "signature": null
          },
          {
            "kind": "re-export",
            "name": "RustBulkDataEngine",
            "signature": null
          },
          {
            "kind": "re-export",
            "name": "SchemaInfo",
            "signature": null
          },
          {
            "kind": "re-export",
            "name": "cancel",
            "signature": null
          },
          {
            "kind": "re-export",
            "name": "convert",
            "signature": null
          },
          {
            "kind": "re-export",
            "name": "filter_export",
            "signature": null
          },
          {
            "kind": "re-export",
            "name": "inspect",
            "signature": null
          },
          {
            "kind": "re-export",
            "name": "preview",
            "signature": null
          },
          {
            "kind": "re-export",
            "name": "scan_batch",
            "signature": null
          }
        ],
        "test_paths": [],
        "unit_mentions": [],
        "validation_paths": []
      }
    },
    {
      "authority_status": "not-applicable",
      "bytes_lf": 4955,
      "classification": "non-calculation",
      "classification_basis": "no-conservative-calculation-signal",
      "content_sha256_lf": "0504c4b7130f016886e3a64fad99745c4cff6f29c9d3f6a44db23895a8831246",
      "family": "shared-tools-non-calculation",
      "id": "TOOLS-MODULE-SRC-SHARED-PYTHON-DATA-PROCESSOR-IO-BULK-FACADE-PY-D6B9D20D6CC8",
      "language": "python",
      "maintainer": "Tools module maintainers",
      "path": "src/shared/python/data_processor_io/bulk_facade.py",
      "purpose": "Compatibility facade for the shared data-processor fallback package.",
      "review_status": "inventory-baseline",
      "risk_tags": [
        "downstream-consumer-risk",
        "public-api"
      ],
      "states": {
        "adrs": "mapped",
        "artifacts": "not-applicable",
        "chapters": "unmapped-pending-TOOLS-D4",
        "citations": "not-applicable",
        "equation_pathway": "not-applicable",
        "public_surfaces": "mapped",
        "publication": "blocked",
        "routes": "not-applicable",
        "tests": "not-applicable",
        "units": "not-applicable",
        "validation": "not-applicable"
      },
      "traceability": {
        "adr_paths": [
          "docs/adr/ADR-002-shared-library-module-structure.md",
          "docs/adr/ADR-003-api-stability-policy.md"
        ],
        "artifact_sha256": [],
        "chapter_paths": [],
        "citation_refs": [],
        "equation_refs": [],
        "public_routes": [],
        "public_surfaces": [
          {
            "kind": "class",
            "name": "BulkConversionReport",
            "signature": null
          },
          {
            "kind": "class",
            "name": "DataProcessorRustError",
            "signature": null
          },
          {
            "kind": "class",
            "name": "DatasetMetadata",
            "signature": null
          },
          {
            "kind": "class",
            "name": "PreviewTable",
            "signature": null
          },
          {
            "kind": "class",
            "name": "RustBulkDataEngine",
            "signature": null
          }
        ],
        "test_paths": [],
        "unit_mentions": [],
        "validation_paths": []
      }
    },
    {
      "authority_status": "not-applicable",
      "bytes_lf": 17849,
      "classification": "non-calculation",
      "classification_basis": "no-conservative-calculation-signal",
      "content_sha256_lf": "bd8e47ca17b6430fd0d756187ac67bd2f66c994a36389236cadc18af561ebcc0",
      "family": "shared-tools-non-calculation",
      "id": "TOOLS-MODULE-SRC-SHARED-PYTHON-DATA-PROCESSOR-IO-RUST-ENGINE-PY-A7E8EE6F3026",
      "language": "python",
      "maintainer": "Tools module maintainers",
      "path": "src/shared/python/data_processor_io/rust_engine.py",
      "purpose": "Python wrapper for the Rust/Polars bulk-I/O engine (issue #2989, Phase 2).",
      "review_status": "inventory-baseline",
      "risk_tags": [
        "downstream-consumer-risk",
        "public-api"
      ],
      "states": {
        "adrs": "mapped",
        "artifacts": "not-applicable",
        "chapters": "unmapped-pending-TOOLS-D4",
        "citations": "not-applicable",
        "equation_pathway": "not-applicable",
        "public_surfaces": "mapped",
        "publication": "blocked",
        "routes": "not-applicable",
        "tests": "mapped",
        "units": "mapped",
        "validation": "mapped"
      },
      "traceability": {
        "adr_paths": [
          "docs/adr/ADR-002-shared-library-module-structure.md",
          "docs/adr/ADR-003-api-stability-policy.md"
        ],
        "artifact_sha256": [],
        "chapter_paths": [],
        "citation_refs": [],
        "equation_refs": [],
        "public_routes": [],
        "public_surfaces": [
          {
            "kind": "class",
            "name": "CancellationToken",
            "signature": null
          },
          {
            "kind": "class",
            "name": "ConversionReport",
            "signature": null
          },
          {
            "kind": "class",
            "name": "OperationCancelled",
            "signature": null
          },
          {
            "kind": "class",
            "name": "SchemaInfo",
            "signature": null
          },
          {
            "kind": "constant",
            "name": "_DISABLE_NATIVE",
            "signature": null
          },
          {
            "kind": "constant",
            "name": "_RUST_AVAILABLE",
            "signature": null
          },
          {
            "kind": "function",
            "name": "cancel",
            "signature": ""
          },
          {
            "kind": "function",
            "name": "convert",
            "signature": "src: str | os.PathLike[str], dst: str | os.PathLike[str], format: str, token: CancellationToken | None=None"
          },
          {
            "kind": "function",
            "name": "filter_export",
            "signature": "path: str | os.PathLike[str], dst: str | os.PathLike[str], predicate: str, columns: Sequence[str] | None=None, token: CancellationToken | None=None"
          },
          {
            "kind": "function",
            "name": "inspect",
            "signature": "path: str | os.PathLike[str]"
          },
          {
            "kind": "function",
            "name": "preview",
            "signature": "path: str | os.PathLike[str], nrows: int=100, columns: Sequence[str] | None=None"
          },
          {
            "kind": "function",
            "name": "scan_batch",
            "signature": "path: str | os.PathLike[str], batch_size: int, columns: Sequence[str] | None=None, token: CancellationToken | None=None"
          }
        ],
        "test_paths": [
          "tests/data_processor_io/test_rust_engine_contract.py"
        ],
        "unit_mentions": [
          "g",
          "s"
        ],
        "validation_paths": [
          "tests/data_processor_io/test_rust_engine_contract.py"
        ]
      }
    }
  ],
  "package": "src/shared/python/data_processor_io",
  "schema_version": "tools-module-inventory-shard/1.1.0"
}
